Tool,Label,Slug,Img,Link,Description,Price,Free Trial
Twitonomy,Analytics,analytics1,https://uploads-ssl.webflow.com/5c5c715c2b0f591069822560/5dc9f8eeb7545f6fc6f6e89b_T58.jpg,https://www.twitonomy.com/,"Browse, search, filter and get insights on the people you follow and those who follow you.",free,Yes
Sketchfab,Animation,animation1,https://uploads-ssl.webflow.com/5c5c715c2b0f591069822560/5dc9dc00052d671b05aea087_T30.jpg,https://sketchfab.com/features/animation,Publish and find animated 3D models online and in VR,$3.99,No
Animate,Animation,animation2,https://uploads-ssl.webflow.com/5c5c715c2b0f591069822560/5dc9dc3eaf8806d6bb36143e_T31.jpg,https://www.adobe.com/products/animate.html,"Design interactive vector and bitmap animations for games, apps, and the web.",$20.99,Yes
Biteable,Animation,animation3,https://uploads-ssl.webflow.com/5c5c715c2b0f591069822560/5dc9dc7466fd1b263e93d647_T28.png,https://biteable.com/animation/,Create gorgeous animation online in an instant,$29,Yes
Animaker,Animation,animation4,https://uploads-ssl.webflow.com/5c5c715c2b0f591069822560/5dc9dcafcd9d01e888ba545e_T32.png,https://www.animaker.com/2d-animation-software,Make animated 2D videos online for free!,$12,Yes
Toon Boom,Animation,animation5,https://uploads-ssl.webflow.com/5c5c715c2b0f591069822560/5dc9dcf3cd9d01372eba55f4_T33.png,https://www.toonboom.com,The most powerful software ever created for animation production.,$23,Yes
KeyShot,Animation,animation6,https://uploads-ssl.webflow.com/5c5c715c2b0f591069822560/5dc9dd2d3fffe2a716f8827b_T34.png,https://www.keyshot.com/animation/,Animated visuals. In real-time.,$995,Yes
ABCYa,Animation,animation7,https://uploads-ssl.webflow.com/5c5c715c2b0f591069822560/5dc9dd61ee803c34d4e7a065_T35.jpg,http://www.abcya.com/animate.htm,ABCya! Animate is the best way for kids to make animations on the web.,free,Yes