Tool,Label,Slug,Img,Link,Description,Price,Free Trial
HotCards,Print,print1,https://uploads-ssl.webflow.com/5c5c715c2b0f591069822560/5dc9f7f3a89295d055125531_T55.jpg,https://hotcards.com/,Hotcards is a Cleveland based online printing and design company serving our community and the Nation with green printing and unparalleled culture,-,-
4imprint,Print,print2,https://uploads-ssl.webflow.com/5c5c715c2b0f591069822560/5dc9f7d7b730b55ec14ad29e_T56.jpg,https://www.4imprint.com/,"Promotional products by 4imprint. Find the perfect promotional items for business branding, saying thanks, or spreading the word.",-,-
Vistaprint,Print,print3,https://uploads-ssl.webflow.com/5c5c715c2b0f591069822560/5dc9f7b5b7545f3980f6d18a_T57.jpg,https://www.vistaprint.com,Vistaprint empowers small businesses like yours to market themselves effectively.,-,-
Inkhead,Print,print4,https://uploads-ssl.webflow.com/5c5c715c2b0f591069822560/5dc9f799a892956249125285_T60.jpg,https://www.deluxe.com/products/brands/inkhead/,InkHead has officially joined Deluxe.com to offer you even more customized Items and merchandise. Login with your InkHead credentials to reorder today!,-,-
Staples,Print,print5,https://uploads-ssl.webflow.com/5c5c715c2b0f591069822560/5dc9f77eb730b5b0164ad1ba_T59.jpg,https://www.staples.com/services/printing/,"Shop Staples for business essentials, printers, ink, computers, office furniture, printing services, promotional products and more. Solutions for Worklife.",-,-
Office Depot,Print,print6,https://uploads-ssl.webflow.com/5c5c715c2b0f591069822560/5dc9f75e5f1e4642cd2acb54_T61.jpg,https://www.officedepot.com/cm/print-and-copy/print-services,"Low prices on office supplies, furniture, paper, electronics, ink and on print & technology services.",-,-
Conquest Graphics,Print,print7,https://uploads-ssl.webflow.com/5c5c715c2b0f591069822560/5dc9f740b7545f40e8f6cdc5_T62.jpg,https://www.conquestgraphics.com/,"With Conquest Graphics' Quick Ship program, and expedited turnarounds available, we are committed to get your project to you when you need it.",-,-
BannerBuzz,Print,print8,,https://www.bannerbuzz.com,"BannerBuzz is your source for custom banner printing, displays, & graphics. Create flags for special events, signs with your logo, & more. Get started today!",-,-